{
  "schemaVersion": 1,
  "toolVersion": "0.2.0",
  "targetProtocol": 28,
  "project": {
    "name": "missing-and-added",
    "type": "unknown"
  },
  "status": "pass",
  "counts": {
    "total": 1,
    "passed": 1,
    "failed": 0,
    "warnings": 0,
    "errors": 0,
    "skipped": 0
  },
  "results": [
    {
      "testId": "dropped",
      "protocol": 28,
      "surface": "xdr",
      "status": "pass",
      "summary": "golden corpus transition",
      "durationMs": 1,
      "fixtureId": "dropped"
    }
  ]
}
