{
  "schemaVersion": 1,
  "toolVersion": "0.1.1",
  "targetProtocol": 28,
  "project": {
    "name": "v011_multi",
    "type": "unknown"
  },
  "status": "fail",
  "counts": {
    "total": 2,
    "passed": 1,
    "failed": 1,
    "warnings": 0,
    "errors": 0,
    "skipped": 0
  },
  "results": [
    {
      "testId": "p28-xdr-valid",
      "protocol": 28,
      "surface": "xdr",
      "status": "pass",
      "summary": "decoded StellarValue successfully",
      "durationMs": 0,
      "fixtureId": "p28-xdr-valid"
    },
    {
      "testId": "p28-xdr-invalid",
      "protocol": 28,
      "surface": "xdr",
      "status": "fail",
      "summary": "failed to decode StellarValue",
      "details": "Invalid symbol 45, offset 3.",
      "durationMs": 0,
      "fixtureId": "p28-xdr-invalid"
    }
  ],
  "git": {
    "commit": "4f58fed2528ba94dc5cc41f532009406a47c9efc",
    "branch": "master",
    "isDirty": false
  }
}
