{
  "schemaVersion": 1,
  "toolVersion": "0.2.0",
  "targetProtocol": 28,
  "project": {
    "name": "empty-current",
    "type": "unknown"
  },
  "status": "pass",
  "counts": {
    "total": 0,
    "passed": 0,
    "failed": 0,
    "warnings": 0,
    "errors": 0,
    "skipped": 0
  },
  "results": []
}
