{
  "schemaVersion": 1,
  "toolVersion": "0.2.0",
  "targetProtocol": 28,
  "project": {
    "name": "observed-protocol-change",
    "type": "unknown"
  },
  "network": {
    "name": "testnet",
    "observedProtocol": 29
  },
  "status": "fail",
  "counts": {
    "total": 1,
    "passed": 0,
    "failed": 1,
    "warnings": 0,
    "errors": 0,
    "skipped": 0
  },
  "results": [
    {
      "testId": "protocol-drift",
      "protocol": 28,
      "surface": "xdr",
      "status": "fail",
      "summary": "golden corpus transition",
      "durationMs": 1,
      "fixtureId": "protocol-drift"
    }
  ]
}
