{
  "schemaVersion": 1,
  "toolVersion": "0.2.0",
  "targetProtocol": 28,
  "project": {
    "name": "all-good-transitions",
    "type": "unknown"
  },
  "status": "error",
  "counts": {
    "total": 6,
    "passed": 2,
    "failed": 1,
    "warnings": 1,
    "errors": 2,
    "skipped": 1
  },
  "results": [
    {
      "testId": "degraded",
      "protocol": 28,
      "surface": "xdr",
      "status": "pass",
      "summary": "golden corpus transition",
      "durationMs": 1,
      "fixtureId": "degraded"
    },
    {
      "testId": "improved",
      "protocol": 28,
      "surface": "xdr",
      "status": "warning",
      "summary": "golden corpus transition",
      "durationMs": 1,
      "fixtureId": "improved"
    },
    {
      "testId": "resolved",
      "protocol": 28,
      "surface": "xdr",
      "status": "fail",
      "summary": "golden corpus transition",
      "durationMs": 1,
      "fixtureId": "resolved"
    },
    {
      "testId": "unchanged-pass",
      "protocol": 28,
      "surface": "xdr",
      "status": "pass",
      "summary": "golden corpus transition",
      "durationMs": 1,
      "fixtureId": "unchanged-pass"
    },
    {
      "testId": "error-resolved",
      "protocol": 28,
      "surface": "rpc",
      "status": "error",
      "summary": "golden corpus transition",
      "durationMs": 1,
      "fixtureId": "error-resolved"
    },
    {
      "testId": "improved-error",
      "protocol": 28,
      "surface": "soroban",
      "status": "error",
      "summary": "golden corpus transition",
      "durationMs": 1,
      "fixtureId": "improved-error"
    }
  ],
  "skipped": [
    {
      "fixtureId": "skip-to-pass",
      "surface": "rpc",
      "reason": "requires a capability not declared by this project",
      "code": "MISSING_CAPABILITY"
    }
  ]
}
